{
  "verdict": "APPROVED",
  "notes": "apra-fleet-tfx.4 is implemented by exactly one commit, 3c6f90d 'refactor(client): remove createPullRequest wrapper for deleted server tool', touching only the two files the bead named (56 deletions, 0 insertions). AC1: `grep -rn 'createPullRequest|create_pull_request' packages/apra-fleet-client --exclude-dir=node_modules` returns no hits (exit 1); that grep covers the package's docs/ too, so no stale reference survives in api-reference.md or getting-started.md. AC2: packages/apra-fleet-client `node --test test/*.test.mjs` -> 31/31 pass, 0 fail; the only test removed is the deleted wrapper's own case (fleet-client-api.test.mjs:194-215), so coverage of every remaining wrapper is untouched. AC3: the commit diff itself is the direct evidence -- it removes exactly the createPullRequest method and nothing else from src/client/api.mjs; corroborated by diffing the method list against the base branch (20 methods before, 19 after, sole difference `async createPullRequest(`). The commit also drops the now-orphaned CreatePullRequestOptions typedef and the method's JSDoc block, which is correct cleanup rather than scope creep (both existed solely to document the deleted method). Cross-package regression check: packages/apra-fleet-se/fleet-sprint/runner.js:4075-4084 constructs an ApraFleet and branches on `typeof fleetApi.createPullRequest === 'function'`, falling through to a raw callTool('create_pull_request', ...) whose failure is caught at :4120-4125 and degraded to the gh path -- so removing the method cannot hard-break the runner; confirmed empirically by running packages/apra-fleet-se/test/server-side-pr-creation.test.mjs, still 17/17 pass. The remaining create_pull_request references in runner.js (:4058-4143, :4612, :8836) and bin/cli.mjs:777 are owned by sibling beads tfx.5/tfx.6 and are correctly out of scope here. No security concerns -- pure deletion, no secrets, no behavioural surface added. File hygiene clean: only bead-named files changed. git status --porcelain is non-empty, but every entry matches the reviewer-harness scratch pattern .fleet-*review*.json (untracked, never committed, not part of the branch); a .gitignore entry for .fleet-*.json would be tidy. Root vitest was not re-run for this commit because it touches no file under src/ or tests/ (it was green at the parent commit, 205 files / 2891 passed).",
  "reopenIds": [],
  "newTasks": []
}
