{
  "verdict": "APPROVED",
  "notes": "apra-fleet-tfx.3 is implemented by exactly one commit, 13b5006 'revert(vcs): delete server-side create_pull_request MCP tool', touching exactly the three files the bead named (334 deletions, 0 insertions). AC1: src/tools/create-pull-request.ts (-160) and tests/create-pull-request.test.ts (-170) are both deleted. AC2: `grep -rn 'create_pull_request|createPullRequest' src/` returns no hits (exit 1). AC3: npm run build (build:contract + tsc) exits 0 -- no orphaned import, no dangling registry entry; root vitest 205 files / 2891 passed, 36 skipped, exit 0, exactly one test file and its cases fewer than the pre-commit baseline I measured this session (206 files / 2898 passed), i.e. the deleted suite and nothing else -- no collateral test loss. AC4: src/services/tool-registry.ts drops both the dynamic import (line ~25) and the server.tool('create_pull_request', ...) registration (line ~123), so the tool provably cannot be advertised at runtime; there is no tool-list snapshot test in tests/ to update, so removal of the registration call is the whole of the check available. Scope discipline is correct: the commit does NOT touch packages/apra-fleet-se/fleet-sprint/runner.js or packages/apra-fleet-client, per the bead's explicit instruction. The surviving create_pull_request references in packages/apra-fleet-client/src/client/api.mjs:356-357 (+ its test) and packages/apra-fleet-se/fleet-sprint/runner.js:4058-4087 / bin/cli.mjs:775-777 are expected leftovers owned by sibling beads tfx.4, tfx.5 and tfx.6, not defects of tfx.3; they leave the umbrella transiently inconsistent (a client wrapper calling a tool the server no longer registers) until those land, and that window is by design in the planner's file-partitioned split. Prerequisite ordering holds: blocking bead apra-fleet-6bu.1 closed 08:54Z with the pull_requests:write GRANTED determination, ahead of this commit at 09:08Z, satisfying tfx AC8. No security concerns -- a pure deletion that removes a repo-mutating code path from the server process; no secrets in the diff. Only bead-named files changed, so file hygiene is clean. git status --porcelain is non-empty, but every entry matches the reviewer-harness scratch pattern .fleet-*review*.json (untracked, never committed, not part of the branch); a .gitignore entry for .fleet-*.json would be tidy. The packages/apra-fleet-se node --test suite was not re-run because this commit touches no fleet-se file.",
  "reopenIds": [],
  "newTasks": []
}
