{
  "verdict": "APPROVED",
  "notes": "apra-fleet-tfx.5 (commit 07baf2c, 2 files: runner.js, bin/cli.mjs) meets all four acceptance criteria.\n\nAC1 -- grep -n 'create_pull_request|createServerSidePrCreator|attemptServerSidePrCreate' over runner.js and cli.mjs returns zero hits. A repo-wide grep (excluding node_modules/dist) shows the only remaining references live in packages/apra-fleet-se/test/ (server-side-pr-creation.test.mjs, helpers/mock-sprint-harness.mjs:1102-1160, dispatch-safety-guard.test.mjs:214 comment) -- exactly the test/fixture cleanup tfx.6 owns, and tfx.5 was explicitly told not to touch test files. No non-test module imports a now-deleted export, so nothing can fail at ESM link time.\n\nAC2 -- finalizeAbort's signature (runner.js:4461) no longer accepts createPullRequest; the JSDoc entry was removed with it, and the only call site (main(), ~8925) now passes { error, branch, baseBranch, member, command, log }.\n\nAC3 -- no dead helpers or imports left: ApraFleet (runner.js:20), parseOwnerRepoFromRemoteUrl (:1981), selfHealResultText (:1999) and isHostedGithubRemote (:4040) all still have live non-PR callers; originUrl is still consumed by the hosted-remote guard at :8628. Both explanatory 6bu comment blocks were removed rather than left orphaned. node --check passes on both files.\n\nAC4 -- the restored call sites are byte-identical to their pre-c5e66566 form. Diffing c5e66566^:runner.js lines 4340-4400 vs current 4480-4540 (finalizeAbort PR block) and 8340-8385 vs 8669-8714 (Publish PR block) both return zero differences, so the dispatch shape, the idempotent 'already exists' handling and the CommandError text are provably unchanged. For the cli.mjs half, 'git diff c5e66566^..HEAD -- packages/apra-fleet-se/bin/cli.mjs' returns empty output: the file is byte-identical to its pre-c5e66566 state, which proves the binding revert (including the explanatory comment block) exactly rather than by inspection.\n\nGates run on the branch tip:\n- npm run build (build:contract + tsc): clean, exit 0.\n- npm run lint: not configured in this repo (root package.json has no lint script) -- skipped, not a finding.\n- Root vitest: 205 files / 2891 tests passed, 36 skipped, exit 0.\n- apra-fleet-se npm test: 1513/1519 pass, 3 failures, all accounted for and none caused by this change:\n  1. server-side-pr-creation.test.mjs -- imports the two deleted exports; tfx.6 deletes this file.\n  2. dispatch-safety-guard.test.mjs -- 'Expected 45 command() call site(s) in runner.js, found 44'. Correct: tfx.5 removed the 'git remote get-url origin' probe from finalizeAbort. HANDOFF CORRECTION FOR tfx.6: the umbrella tells tfx.6 to restore this constant to 42, but that number is stale -- commit 64dc595 (jfo verify-route) independently bumped it 43 -> 45, so the correct post-tfx.5 value is 44, not 42. The stale comment block at dispatch-safety-guard.test.mjs:207-214 describing the create_pull_request path also needs deleting there.\n  3. golden-transcript.test.mjs -- independently verified as NOT caused by tfx.5. The first divergence is at dispatch seq 96 (JSONL line 97) and is purely integ-test-runner-output schema drift: the actual prompt carries the new verifySetClosed/verifySetLeftOpen properties that test/fixtures/golden-transcript/mock-sprint-happy-path.jsonl lacks. Introduced by the jfo verify-route work (64dc595 / 4ea4429); nothing to do with PR creation.\n\nFOLLOW-UP RECOMMENDED (not owned by tfx.5 or tfx.6, so no bead covers it today; recommend a P2 bead be filed): regenerate test/fixtures/golden-transcript/mock-sprint-happy-path.jsonl for the jfo schema fields via 'npm run update-golden -w @apralabs/apra-fleet-se' (or UPDATE_GOLDEN=1 node --test test/golden-transcript.test.mjs), reviewing the regenerated snapshot to confirm only the schema-property delta lands and no dispatch-sequence change sneaks in. tfx.6's fixture scope per the umbrella covers only the two apra-fleet-mock-sprint-serversidepr*.jsonl files and the mock-sprint-harness prToolHandler wiring.\n\nFile hygiene: the commit touches only the two files the task names -- no temp files, tool config or unrelated scripts. Reviewed strictly against 07baf2c; the other ~45 commits in the base..branch range belong to other beads and were not audited here. git status --porcelain is non-empty only for untracked .fleet-review-*.json / .fleet-plan-review-output.json files, which are this review harness's own outputs rather than branch content -- not a finding.",
  "reopenIds": [],
  "newTasks": []
}
