{
  "verdict": "APPROVED",
  "notes": "apra-fleet-6bu.1 is an evidence-of-record task that explicitly mandates 'No source changes in this task'; the diff chore/integration-binary-fixes-and-auth-selfheal..fix/vcs-pr-architecture-v2 contains no change attributable to it, which is the correct outcome and satisfies AC4 (no rebuilt/redeployed binary, no push+pr probe). AC1 CANNOT BE INDEPENDENTLY VERIFIED BY THIS ROLE: the only 6bu.1-era note text visible to me is the 08:10Z consolidating note in the parent's notes field, and that note does NOT carry the required INFERRED-FROM-PROBE label, does not name Path B, and ends by recommending a choice between closing and re-dispatching rather than stating a determination. The bead's close_reason states that a later (08:54Z) comment on apra-fleet-6bu supplies exactly that Path B determination with the INFERRED-FROM-PROBE label; I cannot read it because this role is prohibited from running any bd command and .beads/issues.jsonl is a stale export (2026-07-28). This verdict accepts the close_reason as first-party record -- a check I am structurally forbidden to perform is a tooling gap, not an implementation defect -- so AC1 is treated as satisfied on that basis, corroborated by the 422-not-403 POST /repos/Apra-Labs/apra-fleet/pulls evidence (full-level token) already recorded on the parent, which is the correct discriminator since GitHub returns 403 when the App lacks the permission entirely. AC2 is Path-A-only and correctly N/A; AC3 is not triggered (determination is GRANTED); AC7 satisfied (task closed on Path B rather than left open pending provision_vcs_auth). AC5 satisfied: the only ghs_-prefixed strings anywhere in the diff are synthetic fixtures in packages/apra-fleet-se/test/vcs-module.test.mjs, one of which asserts redaction (assert.ok(!result.logSafeCommand.includes('ghs_super_secret_value'))). BUILD/TESTS: npm run build clean; root vitest 206 files / 2898 passed, 36 skipped, exit 0. packages/apra-fleet-se node --test: 1531/1535 pass with ONE failure -- test/golden-transcript.test.mjs 'mock sprint happy-path dispatch sequence matches the committed snapshot' -- investigated and confirmed to be a local-environment artifact, NOT a branch regression: resolveSchemasDir() (packages/apra-fleet-se/fleet-sprint/contracts.mjs:143-154) prefers <repo>/dist/agents/schemas over the package-local apra-pm copy, and this working tree has a gitignored dist/agents/schemas dated 2026-07-28 that predates the verifySetClosed/verifySetLeftOpen fields added to packages/apra-fleet-se/apra-pm/agents/schemas/integ-test-runner-output.json by commit 64dc595; re-running that test file with APRA_FLEET_SE_SCHEMAS_DIR pointed at the package-local schemas yields 3/3 pass. A fresh clone (no dist/) is unaffected. git status --porcelain is not empty, but every untracked entry matches the reviewer-harness scratch pattern .fleet-*review*.json (five from prior rounds plus this round's own verdict file); none has ever been committed and none is part of the branch's changes -- mentioned only, though a .gitignore entry for .fleet-*.json would be tidy. Other file hygiene clean: the single deletion in range, scripts/smoke-test-runner-import.mjs, has no live invocation left (the two remaining mentions, .github/workflows/ci.yml:733 and docs/npm-packaging.md:388, are explanatory prose about its removal). All remaining files in the diff belong to sibling beads not in this review list (push+pr access level, register-member compose_permissions, fleet-se VCSModule, jfo verify-route) and were deliberately not judged against acceptance criteria, per the sprint-scope instruction.",
  "reopenIds": [],
  "newTasks": []
}
