{
  "verdict": "APPROVED",
  "notes": "Both beads verified against their acceptance criteria on fix/integ-verify-fyc-supervisor-auth-2 (2 commits: ffd568d fyc.2.1, 06622cd fyc.2.2). fyc.2.1: zero dist/fleet-sprint hits in ci.yml/scripts; gating steps repointed to packages/apra-fleet-se/{bin/cli.mjs,fleet-sprint/runner.js,workflow.json}, all present in the files allowlist and confirmed by a real npm pack --dry-run locally; Build+shebang+dry-run steps reproduced green; the clean-prefix smoke path (npm pack -> npm install --prefix -> apra-fleet install --skill none --workflows all --transport stdio -> apra-fleet workflow fleet-sprint --help) ran green locally, printing 'Usage: fleet-se sprint' with no dev-fallback warning; smoke-test-runner-import.mjs deleted with its invocation (cli.mjs statically imports ../fleet-sprint/runner.js, so --help covers the same graph); ci.yml parses as YAML and the Clean-pack guard is untouched; the 2-line package-lock bin sync is justified. fyc.2.2: docs-only commit; remaining bundle-se/dist-fleet-sprint mentions are clearly-labelled historical context; bin and prepublishOnly rows match package.json verbatim; 8.3 walkthrough mirrors the new ci.yml; 7.1 lists the current files allowlist; ASCII-only; tarball figures 1.1MB/4.4MB/891 files reproduce exactly. Gates: build exit 0, no lint script configured, npm test exit 0 (204 files passed / 7 skipped, 2868 tests passed). Informational only: stderr in the local smoke run carried a pre-existing '[warn] could not resolve the fleet server: Cannot find package @apralabs/apra-fleet-client imported from dist/cli/workflow.js' (not asserted, not a new regression); the smoke step's apra-fleet install omits --force (fine on a fresh runner); the parent fyc.2's manual-publish SEA-artifact footgun is out of scope for these two beads.",
  "reopenIds": [],
  "newTasks": []
}
